{
  "schema_version": "echomind.eval_report.v1",
  "report_name": "baseline_v1",
  "generated_at": "2026-07-29T06:39:36.698163Z",
  "dataset": {
    "name": "customer_support_eval_v1",
    "path": "/home/li/workspace/EchoMind/evaluation/datasets/customer_support_eval_v1.jsonl",
    "case_count": 21
  },
  "runtime": {
    "base_url": "http://127.0.0.1:8000",
    "health_status": "ok",
    "judge_enabled": false,
    "judge_model": null
  },
  "metrics": {
    "intent_accuracy": 0.0,
    "agent_routing_accuracy": 0.5238,
    "escalation_accuracy": 0.8571,
    "rag_usage_recall": 1.0,
    "tool_selection_accuracy": null,
    "task_completion_rate": null,
    "grounded_response_rate": null,
    "avg_latency_ms": 10740.28,
    "p95_latency_ms": 17544.3,
    "avg_tokens_per_session": null,
    "tool_success_rate": null
  },
  "summary": {
    "total_cases": 21,
    "scenes": {
      "general": 3,
      "billing": 5,
      "technical": 4,
      "account": 3,
      "complaint": 2,
      "escalation": 2,
      "mixed": 2
    },
    "unsupported_metrics": [
      "tool_selection_accuracy",
      "grounded_response_rate",
      "avg_tokens_per_session",
      "tool_success_rate"
    ],
    "failed_case_count": 21,
    "failed_cases_preview": [
      {
        "id": "general_product_001",
        "scene": "general",
        "actual_intent": "query",
        "actual_agent": "general",
        "actual_escalated": false
      },
      {
        "id": "general_usage_001",
        "scene": "general",
        "actual_intent": "query",
        "actual_agent": "general",
        "actual_escalated": true
      },
      {
        "id": "general_usage_002",
        "scene": "general",
        "actual_intent": "query",
        "actual_agent": "general",
        "actual_escalated": false
      },
      {
        "id": "billing_refund_001",
        "scene": "billing",
        "actual_intent": "request",
        "actual_agent": "general",
        "actual_escalated": false
      },
      {
        "id": "billing_refund_002",
        "scene": "billing",
        "actual_intent": "request",
        "actual_agent": "general",
        "actual_escalated": false
      },
      {
        "id": "billing_charge_001",
        "scene": "billing",
        "actual_intent": "billing",
        "actual_agent": "billing",
        "actual_escalated": false
      },
      {
        "id": "billing_invoice_001",
        "scene": "billing",
        "actual_intent": "query",
        "actual_agent": "general",
        "actual_escalated": false
      },
      {
        "id": "billing_invoice_002",
        "scene": "billing",
        "actual_intent": "query",
        "actual_agent": "general",
        "actual_escalated": false
      },
      {
        "id": "technical_login_001",
        "scene": "technical",
        "actual_intent": "technical",
        "actual_agent": "technical",
        "actual_escalated": false
      },
      {
        "id": "technical_login_002",
        "scene": "technical",
        "actual_intent": "technical",
        "actual_agent": "technical",
        "actual_escalated": false
      },
      {
        "id": "technical_connection_001",
        "scene": "technical",
        "actual_intent": "technical",
        "actual_agent": "technical",
        "actual_escalated": false
      },
      {
        "id": "technical_bug_001",
        "scene": "technical",
        "actual_intent": "technical",
        "actual_agent": "technical",
        "actual_escalated": false
      },
      {
        "id": "account_password_001",
        "scene": "account",
        "actual_intent": "account",
        "actual_agent": "billing",
        "actual_escalated": false
      },
      {
        "id": "account_permission_001",
        "scene": "account",
        "actual_intent": "technical",
        "actual_agent": "technical",
        "actual_escalated": false
      },
      {
        "id": "account_permission_002",
        "scene": "account",
        "actual_intent": "account",
        "actual_agent": "billing",
        "actual_escalated": false
      },
      {
        "id": "complaint_service_001",
        "scene": "complaint",
        "actual_intent": "complaint",
        "actual_agent": "general",
        "actual_escalated": false
      },
      {
        "id": "complaint_escalation_001",
        "scene": "complaint",
        "actual_intent": "escalation",
        "actual_agent": "general",
        "actual_escalated": true
      },
      {
        "id": "escalation_request_001",
        "scene": "escalation",
        "actual_intent": "escalation",
        "actual_agent": "general",
        "actual_escalated": true
      },
      {
        "id": "mixed_tech_billing_001",
        "scene": "mixed",
        "actual_intent": "other",
        "actual_agent": "general",
        "actual_escalated": true
      },
      {
        "id": "mixed_account_billing_001",
        "scene": "mixed",
        "actual_intent": "billing",
        "actual_agent": "billing",
        "actual_escalated": false
      }
    ],
    "metrics_ready_for_comparison": [
      "intent_accuracy",
      "agent_routing_accuracy",
      "escalation_accuracy",
      "rag_usage_recall",
      "avg_latency_ms",
      "p95_latency_ms"
    ]
  },
  "cases": [
    {
      "id": "general_product_001",
      "scene": "general",
      "difficulty": "easy",
      "risk_level": "low",
      "input": {
        "user_query": "你们这个智能客服系统主要能帮企业解决什么问题？",
        "history": [],
        "user_profile": {
          "tier": "standard",
          "region": "CN",
          "language": "zh-CN"
        }
      },
      "expectation": {
        "expected_intent": "general_product_consult",
        "expected_agent": "general",
        "requires_tool": false,
        "expected_tools": [],
        "requires_rag": true,
        "must_escalate": false,
        "expected_outcome": "answer_with_rag",
        "gold_answer_points": [
          "说明系统面向企业客服场景",
          "提到典型能力如意图识别、知识检索或多轮支持",
          "回答保持概括性而不是编造未给出的承诺"
        ],
        "forbidden_behaviors": [
          "捏造不存在的企业客户案例",
          "承诺未说明的商业功能"
        ]
      },
      "actual": {
        "conv_id": "eval_general_product_001_a559d611",
        "response": "EchoMind 智能客服能帮助企业高效处理客户的首轮咨询和常见问题，主要解决以下三类问题：\n\n1.  **降低人工服务压力**：7×24小时自动解答账户安全、常见技术故障（如登录出错、应用崩溃）、订单状态查询等重复性高频问题。\n2.  **提升问题处理效率**：通过标准化的接待流程，自动收集订单号、问题描述等关键信息，并准确分流到技术支持或账单支持等专业团队，减少用户重复描述。\n3.  **保障服务规范性**：按照预设的业务规则和知识库给出标准、安全的回复（例如不索要密码、不承诺无法保证的结果），确保服务质量和响应一致性。\n\n简单来说，它能作为企业的“第一道服务防线”，快速解决简单问题，并将复杂问题有序交给人工处理。如果您有具体的咨询问题，也欢迎直接提出。",
        "intent": "query",
        "agent_type": "general",
        "escalated": false,
        "latency_ms": 9842.5,
        "knowledge_used": true
      },
      "checks": {
        "intent_match": false,
        "agent_match": true,
        "escalation_match": true,
        "rag_usage_match": true,
        "tool_selection_match": null
      },
      "judge": {
        "enabled": false,
        "scores": null,
        "error": null
      }
    },
    {
      "id": "general_usage_001",
      "scene": "general",
      "difficulty": "easy",
      "risk_level": "low",
      "input": {
        "user_query": "知识库上传之后，客服回答一般多久能用上新内容？",
        "history": [],
        "user_profile": {
          "tier": "standard",
          "region": "CN",
          "language": "zh-CN"
        }
      },
      "expectation": {
        "expected_intent": "general_usage_help",
        "expected_agent": "general",
        "requires_tool": false,
        "expected_tools": [],
        "requires_rag": true,
        "must_escalate": false,
        "expected_outcome": "answer_with_rag",
        "gold_answer_points": [
          "说明需视知识库处理流程而定",
          "若无法确认具体时效应明确说明",
          "给出建议如等待同步或联系管理员确认"
        ],
        "forbidden_behaviors": [
          "杜撰固定同步时延",
          "声称已经检查到用户的知识库状态"
        ]
      },
      "actual": {
        "conv_id": "eval_general_usage_001_5d24077d",
        "response": "关于知识库上传后新内容生效的时间，目前我没有掌握具体的系统更新延迟参数。这类技术细节通常需要后台技术支持团队才能确认。\n\n建议你联系**技术支持**或**转接人工客服**，他们可以帮你查询知识库同步的周期。\n\n如果你是在使用过程中遇到内容更新不及时的情况，也可以直接说明具体问题，我会尝试依据已有知识库先提供帮助。",
        "intent": "query",
        "agent_type": "general",
        "escalated": true,
        "latency_ms": 5733.0,
        "knowledge_used": true
      },
      "checks": {
        "intent_match": false,
        "agent_match": true,
        "escalation_match": false,
        "rag_usage_match": true,
        "tool_selection_match": null
      },
      "judge": {
        "enabled": false,
        "scores": null,
        "error": null
      }
    },
    {
      "id": "general_usage_002",
      "scene": "general",
      "difficulty": "medium",
      "risk_level": "low",
      "input": {
        "user_query": "我第一次配置这个系统，不知道该先配知识库还是先配客服角色。",
        "history": [],
        "user_profile": {
          "tier": "standard",
          "region": "CN",
          "language": "zh-CN"
        }
      },
      "expectation": {
        "expected_intent": "general_usage_help",
        "expected_agent": "general",
        "requires_tool": false,
        "expected_tools": [],
        "requires_rag": true,
        "must_escalate": false,
        "expected_outcome": "answer_with_rag",
        "gold_answer_points": [
          "给出合理的初始配置顺序建议",
          "说明知识库和角色配置各自作用",
          "若存在依赖关系应明确指出"
        ],
        "forbidden_behaviors": [
          "捏造不存在的强制配置顺序"
        ]
      },
      "actual": {
        "conv_id": "eval_general_usage_002_0297fb18",
        "response": "建议先配置**知识库**，再配置客服角色。原因如下：\n\n1. **知识库是回答的基础**：客服需要根据知识库内容来解答用户问题。如果知识库内容不完整或不准确，客服角色定义得再好，也无法有效处理问题。\n2. **角色依赖知识内容**：客服角色的接待规范、分流规则等，最终都围绕知识库中的信息执行。先搭建好内容框架，角色功能才能与实际业务需求匹配。\n3. **降低后续调整成本**：如果先配置角色再补充知识，可能出现角色规则与知识库不兼容的情况，需要反复调整。\n\n如果你需要具体配置指导，可以告诉我你计划接入哪些业务场景（例如订单查询、退款、账户安全等），我可以帮你整理知识库的优先结构。",
        "intent": "query",
        "agent_type": "general",
        "escalated": false,
        "latency_ms": 10082.2,
        "knowledge_used": true
      },
      "checks": {